{
  "kind": "arbitration",
  "decision_id": "D-2025-0001",
  "arbiter": {
    "actor_id": "arbiter-core",
    "actor_type": "system",
    "display_name": "ICEP Arbiter"
  },
  "considered_intents": ["I-2025-0001", "I-2025-0002"],
  "accepted_intent_id": "I-2025-0001",
  "accepted_state": {
    "type": "git",
    "ref": "c4d9a1f0"
  },
  "rejected_intents": ["I-2025-0002"],
  "conflicts": [
    {
      "intent_ids": ["I-2025-0001", "I-2025-0002"],
      "reason": "Overlapping scope in auth module",
      "scope_overlap": {
        "modules": ["auth"]
      },
      "constraint_ids": ["C-ARCH-004"]
    }
  ],
  "policy": {
    "name": "priority-then-earliest",
    "version": "1.0",
    "parameters": { "priority_tag": "high" }
  },
  "evidence_ids": ["E-2025-0001"],
  "created_at": "2025-01-15T13:00:00Z"
}
